<?xml version="1.0" encoding="UTF-8" ?>

<AnimalsAndProperties xmlns:xsi="http://www.w3.org/2001/XMLSchema-instance" xsi:noNamespaceSchemaLocation="AnimalsAndProperties.xsd">
	<Pet>
		<ID>1</ID>
		<Type>Dog</Type>
		<Name>Max</Name>
		<DateOfBirth>01/05/20</DateOfBirth>
		<Owner_ID>2</Owner_ID>
		<Animal_ID>3</Animal_ID>
	</Pet>
	<Dog>
		<ID>1</ID>
		<Breed>German Shepherd</Breed>
		<Pet_ID>1</Pet_ID>
	</Dog>
	<WildAnimal>
		<ID>2</ID>
		<Type>Wolf</Type>
		<Animal_ID>2</Animal_ID>
	</WildAnimal>
	<HomeContinent>
		<ID>1</ID>
		<HomeContinent>Europe</HomeContinent>
		<WildAnimal_ID>2</WildAnimal_ID>
	</HomeContinent>
	<DomesticOrWild>
		<ID>4</ID>
		<Type>Horse</Type>
		<IsDomesticated>True</IsDomesticated>
		<Animal_ID>5</Animal_ID>
	</DomesticOrWild>
</AnimalsAndProperties>